<?xml version="1.0" encoding="UTF-8"?>
<!DOCTYPE recipes SYSTEM "recipes.dtd">
<recipes xmlns:xsi="http://www.w3.org/2001/XMLSchema-instance" xsi:noNamespaceSchemaLocation="recipes.xsd">
    <recipe id="1">
        <name>Salmon Tacos with Mango Corn Salsa</name>
        <description>Super easy salmon tacos loaded with a mango, sweet corn, and cucumber salsa!</description>
        <image>recipe1.jpg</image>
        <preparationTime>20</preparationTime>
        <servings>4</servings>
        <difficulty>Easy</difficulty>
        <calories>300</calories>
    </recipe>
    <recipe id="2">
        <name>Instant Pot Cauliflower Curry</name>
        <description>Tender cauliflower, butternut squash, and red lentils cooked in a coconut-creamy red curry sauce and poured over a mini-mountain of steamy rice.</description>
        <image>recipe2.webp</image>
        <preparationTime>45</preparationTime>
        <servings>6</servings>
        <difficulty>Medium</difficulty>
        <calories>350</calories>
    </recipe>
    <recipe id="3">
        <name>Springy Blueberry Lemon Bread</name>
        <description>A light and fluffy blueberry lemon bread perfect for springtime!</description>
        <image>recipe3.jpg</image>
        <preparationTime>30</preparationTime>
        <servings>8</servings>
        <difficulty>Medium</difficulty>
        <calories>400</calories>
    </recipe>
</recipes>
